{
  "id": "el-presidente",
  "name": "El Presidente",
  "boundsW": 10,
  "boundsH": 14,
  "minRounds": 12,
  "startPose": { "x": 5, "y": 1, "facingDeg": 180 },
  "targets": [
    { "id": 1, "kind": "paperIpsc", "requiredHits": 2, "pose": { "x": 3, "y": 11 } },
    { "id": 2, "kind": "paperIpsc", "requiredHits": 2, "pose": { "x": 5, "y": 11 } },
    { "id": 3, "kind": "paperIpsc", "requiredHits": 2, "pose": { "x": 7, "y": 11 } }
  ]
}
